05:47:29.007868 IP 172.20.155.155.47532 > DESKTOP-MC5KP54.mshome.net.domain: 40209+ A? smtp.sendgrid.net. (35)                                                                                       05:47:29.007886 IP 172.20.155.155.47532 > DESKTOP-MC5KP54.mshome.net.domain: 6694+ AAAA? smtp.sendgrid.net. (35)                                                                                     05:47:29.202918 IP DESKTOP-MC5KP54.mshome.net.domain > 172.20.155.155.47532: 40209- 4/0/0 A 18.197.194.208, A 108.128.229.184, A 54.228.39.88, A 52.57.139.126 (116)                                 05:47:29.518697 IP DESKTOP-MC5KP54.mshome.net.domain > 172.20.155.155.47532: 6694- 4/0/0 AAAA 64:ff9b::3439:8b7e, AAAA 64:ff9b::36e4:2758, AAAA 64:ff9b::6c80:e5b8, AAAA 64:ff9b::12c5:c2d0 (164)    05:47:29.520807 IP 172.20.155.155.39416 > ec2-18-197-194-208.eu-central-1.compute.amazonaws.com.submission: Flags [S], seq 2257535384, win 64240, options [mss 1460,sackOK,TS val 302044447 ecr 0,nop,wscale 7], length 0                                                                                                                                                                                 05:47:29.552224 IP ec2-18-197-194-208.eu-central-1.compute.amazonaws.com.submission > 172.20.155.155.39416: Flags [S.], seq 2255486157, ack 2257535385, win 65535, options [mss 1400,sackOK,TS val 82947997 ecr 302044447,nop,wscale 10], length 0                                                                                                                                                        05:47:29.552442 IP 172.20.155.155.39416 > ec2-18-197-194-208.eu-central-1.compute.amazonaws.com.submission: Flags [.], ack 1, win 502, options [nop,nop,TS val 302044478 ecr 82947997], length 0     05:47:29.552844 IP 172.20.155.155.39416 > ec2-18-197-194-208.eu-central-1.compute.amazonaws.com.submission: Flags [P.], seq 1:37, ack 1, win 502, options [nop,nop,TS val 302044479 ecr 82947997], length 36                                                                                                                                                                                              05:47:29.597046 IP ec2-18-197-194-208.eu-central-1.compute.amazonaws.com.submission > 172.20.155.155.39416: Flags [.], ack 37, win 96, options [nop,nop,TS val 82948041 ecr 302044479], length 0     05:47:29.903673 IP ec2-18-197-194-208.eu-central-1.compute.amazonaws.com.submission > 172.20.155.155.39416: Flags [P.], seq 1:55, ack 37, win 97, options [nop,nop,TS val 82948347 ecr 302044479], length 54                                                                                                                                                                                              05:47:29.903750 IP 172.20.155.155.39416 > ec2-18-197-194-208.eu-central-1.compute.amazonaws.com.submission: Flags [.], ack 55, win 502, options [nop,nop,TS val 302044830 ecr 82948347], length 0    05:47:29.907410 IP ec2-18-197-194-208.eu-central-1.compute.amazonaws.com.submission > 172.20.155.155.39416: Flags [P.], seq 55:185, ack 37, win 97, options [nop,nop,TS val 82948347 ecr 302044479], length 130                                                                                                                                                                                           05:47:29.907441 IP 172.20.155.155.39416 > ec2-18-197-194-208.eu-central-1.compute.amazonaws.com.submission: Flags [.], ack 185, win 501, options [nop,nop,TS val 302044833 ecr 82948347], length 0   05:47:30.221802 IP DESKTOP-MC5KP54.mshome.net.53537 > 239.255.255.250.1900: UDP, length 175                                                                                                          05:47:31.007702 IP 172.20.155.155.39416 > ec2-18-197-194-208.eu-central-1.compute.amazonaws.com.submission: Flags [P.], seq 37:49, ack 185, win 501, options [nop,nop,TS val 302045934 ecr 82948347], length 12                                                                                                                                                                                           05:47:31.045614 IP ec2-18-197-194-208.eu-central-1.compute.amazonaws.com.submission > 172.20.155.155.39416: Flags [.], ack 49, win 97, options [nop,nop,TS val 82949482 ecr 302045934], length 0     05:47:31.211438 IP ec2-18-197-194-208.eu-central-1.compute.amazonaws.com.submission > 172.20.155.155.39416: Flags [P.], seq 185:203, ack 49, win 97, options [nop,nop,TS val 82949656 ecr 302045934], length 18                                                                                                                                                                                           05:47:31.211465 IP 172.20.155.155.39416 > ec2-18-197-194-208.eu-central-1.compute.amazonaws.com.submission: Flags [.], ack 203, win 501, options [nop,nop,TS val 302046137 ecr 82949656], length 0   05:47:31.222680 IP DESKTOP-MC5KP54.mshome.net.53537 > 239.255.255.250.1900: UDP, length 175                                                                                                          05:47:32.238948 IP DESKTOP-MC5KP54.mshome.net.53537 > 239.255.255.250.1900: UDP, length 175                                                                                                          05:47:33.012711 IP 172.20.155.155.39416 > ec2-18-197-194-208.eu-central-1.compute.amazonaws.com.submission: Flags [P.], seq 49:63, ack 203, win 501, options [nop,nop,TS val 302047938 ecr 82949656], length 14                                                                                                                                                                                           05:47:33.050943 IP ec2-18-197-194-208.eu-central-1.compute.amazonaws.com.submission > 172.20.155.155.39416: Flags [.], ack 63, win 97, options [nop,nop,TS val 82951495 ecr 302047938], length 0     05:47:33.229729 IP ec2-18-197-194-208.eu-central-1.compute.amazonaws.com.submission > 172.20.155.155.39416: Flags [P.], seq 203:221, ack 63, win 97, options [nop,nop,TS val 82951670 ecr 302047938], length 18                                                                                                                                                                                           05:47:33.229793 IP 172.20.155.155.39416 > ec2-18-197-194-208.eu-central-1.compute.amazonaws.com.submission: Flags [.], ack 221, win 501, options [nop,nop,TS val 302048156 ecr 82951670], length 0   05:47:33.246711 IP DESKTOP-MC5KP54.mshome.net.53537 > 239.255.255.250.1900: UDP, length 175                                                                                                          05:47:33.904370 IP DESKTOP-MC5KP54.mshome.net.60367 > 239.255.255.250.1900: UDP, length 175                                                                                                          05:47:34.074167 ARP, Request who-has 172.20.155.155 (00:15:5d:22:6c:0e (oui Unknown)) tell DESKTOP-MC5KP54.mshome.net, length 28                                                                     05:47:34.074239 ARP, Reply 172.20.155.155 is-at 00:15:5d:22:6c:0e (oui Unknown), length 28                                                                                                           05:47:34.917442 IP DESKTOP-MC5KP54.mshome.net.60367 > 239.255.255.250.1900: UDP, length 175                                                                                                          05:47:35.018657 IP 172.20.155.155.39416 > ec2-18-197-194-208.eu-central-1.compute.amazonaws.com.submission: Flags [P.], seq 63:85, ack 221, win 501, options [nop,nop,TS val 302049945 ecr 82951670], length 22                                                                                                                                                                                           05:47:35.052549 IP ec2-18-197-194-208.eu-central-1.compute.amazonaws.com.submission > 172.20.155.155.39416: Flags [.], ack 85, win 97, options [nop,nop,TS val 82953495 ecr 302049945], length 0     05:47:35.350162 IP ec2-18-197-194-208.eu-central-1.compute.amazonaws.com.submission > 172.20.155.155.39416: Flags [P.], seq 221:273, ack 85, win 97, options [nop,nop,TS val 82953793 ecr 302049945], length 52                                                                                                                                                                                           05:47:35.350165 IP ec2-18-197-194-208.eu-central-1.compute.amazonaws.com.submission > 172.20.155.155.39416: Flags [F.], seq 273, ack 85, win 97, options [nop,nop,TS val 82953793 ecr 302049945], length 0                                                                                                                                                                                                05:47:35.350262 IP 172.20.155.155.39416 > ec2-18-197-194-208.eu-central-1.compute.amazonaws.com.submission: Flags [.], ack 273, win 501, options [nop,nop,TS val 302050276 ecr 82953793], length 0   05:47:35.350483 IP 172.20.155.155.39416 > ec2-18-197-194-208.eu-central-1.compute.amazonaws.com.submission: Flags [F.], seq 85, ack 274, win 501, options [nop,nop,TS val 302050276 ecr 82953793], length 0                                                                                                                                                                                               05:47:35.374782 IP ec2-18-197-194-208.eu-central-1.compute.amazonaws.com.submission > 172.20.155.155.39416: Flags [.], ack 86, win 96, options [nop,nop,TS val 82953818 ecr 302050276], length 0     05:47:35.923530 IP DESKTOP-MC5KP54.mshome.net.60367 > 239.255.255.250.1900: UDP, length 175                                                                                                          05:47:36.933764 IP DESKTOP-MC5KP54.mshome.net.60367 > 239.255.255.250.1900: UDP, length 175
